<?xml version="1.0" encoding="UTF-8"?>
<?xml-stylesheet type="text/xsl" href="../Etape5/Expert/padchest_expert_avec_webservice.xsl"?>
<!DOCTYPE padchest_database SYSTEM "../Etape2_Structure/Minimum/padchest_images.dtd">
<padchest_database>
  <image id="20536686640136348236148679891455886468_k6ga29.png">
    <study_id>20536686640136348236148679891455886468</study_id>
    <patient_id>839860488694292331637988235681460987</patient_id>
    <birth_year>1930.0</birth_year>
    <projection>PA</projection>
    <method_projection>Manual review of DICOM fields</method_projection>
    <pediatric>No</pediatric>
    <report_id>4765777</report_id>
    <report> sin hallazg patolog edad pacient .</report>
    <method_label>Physician</method_label>
    <labels>
      <label>normal</label>
    </labels>
    <localizations>
    </localizations>
    <labels_by_sentence>
      <sentence>
        <item>normal</item>
      </sentence>
      <sentence>
        <item>normal</item>
      </sentence>
    </labels_by_sentence>
  </image>
  <image id="135803415504923515076821959678074435083_fzis7d.png">
    <study_id>135803415504923515076821959678074435083</study_id>
    <patient_id>313572750430997347502932654319389875966</patient_id>
    <birth_year>1929.0</birth_year>
    <projection>L</projection>
    <method_projection>Manual review of DICOM fields</method_projection>
    <pediatric>No</pediatric>
    <report_id>4991845</report_id>
    <report> cambi pulmonar cronic sever . sign fibrosis bibasal . sutil infiltr pseudonodul milimetr vidri deslustr localiz bas . cifosis sever .</report>
    <method_label>Physician</method_label>
    <labels>
      <label>pulmonary fibrosis</label>
      <label>chronic changes</label>
      <label>kyphosis</label>
      <label>pseudonodule</label>
      <label>ground glass pattern</label>
    </labels>
    <localizations>
      <localization>loc basal</localization>
      <localization>loc basal bilateral</localization>
    </localizations>
    <labels_by_sentence>
      <sentence>
        <item>pulmonary fibrosis</item>
        <item>loc basal bilateral</item>
      </sentence>
      <sentence>
        <item>chronic changes</item>
      </sentence>
      <sentence>
        <item>kyphosis</item>
      </sentence>
      <sentence>
        <item>pseudonodule</item>
        <item>ground glass pattern</item>
        <item>loc basal</item>
      </sentence>
    </labels_by_sentence>
  </image>
  <image id="135803415504923515076821959678074435083_fzis7b.png">
    <study_id>135803415504923515076821959678074435083</study_id>
    <patient_id>313572750430997347502932654319389875966</patient_id>
    <birth_year>1929.0</birth_year>
    <projection>PA</projection>
    <method_projection>Manual review of DICOM fields</method_projection>
    <pediatric>No</pediatric>
    <report_id>4991845</report_id>
    <report> cambi pulmonar cronic sever . sign fibrosis bibasal . sutil infiltr pseudonodul milimetr vidri deslustr localiz bas . cifosis sever .</report>
    <method_label>Physician</method_label>
    <labels>
      <label>pulmonary fibrosis</label>
      <label>chronic changes</label>
      <label>kyphosis</label>
      <label>pseudonodule</label>
      <label>ground glass pattern</label>
    </labels>
    <localizations>
      <localization>loc basal</localization>
      <localization>loc basal bilateral</localization>
    </localizations>
    <labels_by_sentence>
      <sentence>
        <item>pulmonary fibrosis</item>
        <item>loc basal bilateral</item>
      </sentence>
      <sentence>
        <item>chronic changes</item>
      </sentence>
      <sentence>
        <item>kyphosis</item>
      </sentence>
      <sentence>
        <item>pseudonodule</item>
        <item>ground glass pattern</item>
        <item>loc basal</item>
      </sentence>
    </labels_by_sentence>
  </image>
  <image id="113855343774216031107737439268243531979_3k951l.png">
    <study_id>113855343774216031107737439268243531979</study_id>
    <patient_id>50783093527901818115346441867348318648</patient_id>
    <birth_year>1925.0</birth_year>
    <projection>PA</projection>
    <method_projection>Manual review of DICOM fields</method_projection>
    <pediatric>No</pediatric>
    <report_id>4955977</report_id>
    <report> . . siluet cardi mediastin dentr normal . cambi pulmonar cronic . . . sen costofren libr . . . no sign enfermed metastas .</report>
    <method_label>Physician</method_label>
    <labels>
      <label>chronic changes</label>
    </labels>
    <localizations>
      <localization>loc cardiac</localization>
      <localization>loc mediastinum</localization>
      <localization>loc costophrenic angle</localization>
    </localizations>
    <labels_by_sentence>
      <sentence>
        <item>chronic changes</item>
      </sentence>
      <sentence>
        <item>chronic changes</item>
      </sentence>
      <sentence>
        <item>normal</item>
        <item>loc cardiac</item>
        <item>loc mediastinum</item>
      </sentence>
      <sentence>
        <item>normal</item>
        <item>loc cardiac</item>
        <item>loc mediastinum</item>
      </sentence>
      <sentence>
        <item>normal</item>
      </sentence>
      <sentence>
        <item>normal</item>
      </sentence>
      <sentence>
        <item>normal</item>
        <item>loc costophrenic angle</item>
      </sentence>
    </labels_by_sentence>
  </image>
  <image id="113855343774216031107737439268243531979_3k951n.png">
    <study_id>113855343774216031107737439268243531979</study_id>
    <patient_id>50783093527901818115346441867348318648</patient_id>
    <birth_year>1925.0</birth_year>
    <projection>L</projection>
    <method_projection>Manual review of DICOM fields</method_projection>
    <pediatric>No</pediatric>
    <report_id>4955977</report_id>
    <report> . . siluet cardi mediastin dentr normal . cambi pulmonar cronic . . . sen costofren libr . . . no sign enfermed metastas .</report>
    <method_label>Physician</method_label>
    <labels>
      <label>chronic changes</label>
    </labels>
    <localizations>
      <localization>loc cardiac</localization>
      <localization>loc mediastinum</localization>
      <localization>loc costophrenic angle</localization>
    </localizations>
    <labels_by_sentence>
      <sentence>
        <item>chronic changes</item>
      </sentence>
      <sentence>
        <item>chronic changes</item>
      </sentence>
      <sentence>
        <item>normal</item>
        <item>loc cardiac</item>
        <item>loc mediastinum</item>
      </sentence>
      <sentence>
        <item>normal</item>
        <item>loc cardiac</item>
        <item>loc mediastinum</item>
      </sentence>
      <sentence>
        <item>normal</item>
      </sentence>
      <sentence>
        <item>normal</item>
      </sentence>
      <sentence>
        <item>normal</item>
        <item>loc costophrenic angle</item>
      </sentence>
    </labels_by_sentence>
  </image>
  <image id="313903302629300007485735352869488750471_75sg0k.png">
    <study_id>313903302629300007485735352869488750471</study_id>
    <patient_id>3707275269754751392247446521222810702</patient_id>
    <birth_year>1978.0</birth_year>
    <projection>AP</projection>
    <method_projection>Manual review of DICOM fields</method_projection>
    <pediatric>No</pediatric>
    <report_id>5310833</report_id>
    <report> objet mejori radiolog con practic resolucion infiltr intersticioalveol objetiv estudi previ fech 04 01 2017 persist algun opac mal defin bas izquierd . rest estudi sin cambi relev respect previ con comp .</report>
    <method_label>Physician</method_label>
    <labels>
      <label>unchanged</label>
      <label>alveolar pattern</label>
      <label>interstitial pattern</label>
    </labels>
    <localizations>
      <localization>loc basal</localization>
      <localization>loc left</localization>
    </localizations>
    <labels_by_sentence>
      <sentence>
        <item>unchanged</item>
      </sentence>
      <sentence>
        <item>alveolar pattern</item>
        <item>interstitial pattern</item>
        <item>loc basal</item>
        <item>loc left</item>
      </sentence>
    </labels_by_sentence>
  </image>
  <image id="3137231742710829928-247610802266403640553_km0qf9.png">
    <study_id>3137231742710829928-247610802266403640553</study_id>
    <patient_id>93535126770783451980359712286922420997</patient_id>
    <birth_year>1957.0</birth_year>
    <projection>L</projection>
    <method_projection>Manual review of DICOM fields</method_projection>
    <pediatric>No</pediatric>
    <report_id>4969767</report_id>
    <report> radiografi actual comp con previ 26 juni persistent derram pleural derech . pequen atelectasi subsegmentari bas izquierd . sutur cerclaj esternotomi medi . engros pleural apical izquierd .</report>
    <method_label>Physician</method_label>
    <labels>
      <label>laminar atelectasis</label>
      <label>pleural effusion</label>
      <label>apical pleural thickening</label>
      <label>suture material</label>
      <label>sternotomy</label>
    </labels>
    <localizations>
      <localization>loc basal</localization>
      <localization>loc subsegmental</localization>
      <localization>loc pleural</localization>
      <localization>loc right</localization>
      <localization>loc apical</localization>
      <localization>loc left</localization>
    </localizations>
    <labels_by_sentence>
      <sentence>
        <item>laminar atelectasis</item>
        <item>loc subsegmental</item>
        <item>loc basal</item>
        <item>loc left</item>
      </sentence>
      <sentence>
        <item>pleural effusion</item>
        <item>loc pleural</item>
        <item>loc right</item>
      </sentence>
      <sentence>
        <item>apical pleural thickening</item>
        <item>loc pleural</item>
        <item>loc left</item>
        <item>loc apical</item>
      </sentence>
      <sentence>
        <item>suture material</item>